{
  "engine_id": "EN-00000000000000000000000001",
  "event_cursor": 0,
  "id": "RT-00000000000000000000000001",
  "lifecycle": "initializing",
  "pending_event_ids": [],
  "preparation_cursor": 0,
  "recovery_evidence_refs": [],
  "recovery_status": "checking",
  "schema_version": "do-math-draft/runtime/9",
  "selection_cursor": 0,
  "threshold_holds": []
}
